Handle,Title,Body (HTML),Vendor,Type,Tags,Published,Option1 Name,Option1 Value,Variant SKU,Variant Price
compact-printer-air-advanced-digital,Compact Printer Air Advanced Digital,<p><strong>Compact Printer Air Advanced Digital</strong></p><p>Situation organization these memory much off.</p>,"Garner, Boyle and Flynn",Books & Stationery,,774,Large,Large,2091465262179,265
tablet,Tablet,<p><strong>Tablet</strong></p><p>Discussion loss politics free one thousand.</p>,Mueller Inc,Shoes & Footwear,,81,8x10 in,8x10 in,5286196620740,502
smart-blender-cooker,Smart Blender Cooker,<p><strong>Smart Blender Cooker</strong></p><p>No situation per.</p>,"Lawson, Keller and Winters",Kitchen Appliances,,726,XS,XS,1282898648918,227
advanced-router-rechargeable,Advanced Router Rechargeable,<p><strong>Advanced Router Rechargeable</strong></p><p>For force gas energy six laugh.</p>,Gallagher and Sons,Kitchen Appliances,,896,L,L,3879177514583,121
portable-mouse-monitor-phone,Portable Mouse Monitor Phone,<p><strong>Portable Mouse Monitor Phone</strong></p><p>Feeling back religious however author room scientist.</p>,Irwin LLC,Kids' Clothing,,925,100x200 mm,100x200 mm,9055773261265,1
radio,Radio,<p><strong>Radio</strong></p><p>Character prove growth contain serious customer.</p>,"Benjamin, Nelson and Hancock",Skincare,,549,30x40 cm,30x40 cm,1150028980156,426
ultra-projector-oven-thermostat-prime-advanced,Ultra Projector Oven Thermostat Prime Advanced,<p><strong>Ultra Projector Oven Thermostat Prime Advanced</strong></p><p>Pattern possible look necessary indicate work nearly.</p>,"Mccoy, Waters and Rose",Laptops & Computers,,870,S,S,5029747624534,68
webcam-stove-grill,Webcam Stove Grill,<p><strong>Webcam Stove Grill</strong></p><p>Deep area join carry age.</p>,Morrow and Sons,Automotive,,584,8x10 in,8x10 in,9883725074294,159
eco-radio,Eco Radio,<p><strong>Eco Radio</strong></p><p>Know father for act let.</p>,"Edwards, Odonnell and Conley",Skincare,,499,Medium,Medium,1773215338624,454
ultra-powerbank-brush-charger-max,Ultra Powerbank Brush Charger Max,<p><strong>Ultra Powerbank Brush Charger Max</strong></p><p>Meeting add economic task outside.</p>,"Brennan, Archer and Rosales",Fitness Equipment,,564,Extra Large,Extra Large,4877111475333,845
wireless-dock,Wireless Dock,<p><strong>Wireless Dock</strong></p><p>Whole bill sound whether will.</p>,Russo-West,Health & Wellness,,168,Extra Large,Extra Large,9680811891595,257
fast-camera-router-fan-smart,Fast Camera Router Fan Smart,<p><strong>Fast Camera Router Fan Smart</strong></p><p>Various above trouble itself crime form.</p>,Vazquez and Sons,Cleaning Supplies,,672,Medium,Medium,8567222480604,221
heater-radio,Heater Radio,<p><strong>Heater Radio</strong></p><p>Ten do evidence billion perhaps read bank enter.</p>,Delgado-Blackwell,Cycling,,156,L,L,5686660235911,689
smart-trimmer-webcam-heater,Smart Trimmer Webcam Heater,<p><strong>Smart Trimmer Webcam Heater</strong></p><p>Example available better.</p>,Contreras PLC,Automotive,,818,XXL,XXL,1941032767914,279
webcam-dock-heater,Webcam Dock Heater,<p><strong>Webcam Dock Heater</strong></p><p>State yet soon traditional your deal.</p>,"Juarez, Powell and Travis",Cleaning Supplies,,159,30x40 cm,30x40 cm,1438856474369,101
automatic-watch-lite-sense,Automatic Watch Lite Sense,<p><strong>Automatic Watch Lite Sense</strong></p><p>As east entire positive source their.</p>,"Reid, Chase and Ballard",Team Sports,,329,5x7 in,5x7 in,3500722785805,316
eco-iron-monitor-air,Eco Iron Monitor Air,<p><strong>Eco Iron Monitor Air</strong></p><p>Color single indeed yard event popular food boy.</p>,Barker-Murphy,Automotive,,47,XL,XL,7887280730963,982
digital-tablet-router-printer-lite,Digital Tablet Router Printer Lite,<p><strong>Digital Tablet Router Printer Lite</strong></p><p>Accept campaign every research test.</p>,Vazquez-Smith,Health & Wellness,,732,10x10 cm,10x10 cm,4170125892616,3
eco-freezer-powerbank-watch,Eco Freezer Powerbank Watch,<p><strong>Eco Freezer Powerbank Watch</strong></p><p>Of price visit interesting enter three set.</p>,"Pruitt, Higgins and Barnett",Cleaning Supplies,,618,S,S,6340907128242,340
cooler-fan,Cooler Fan,<p><strong>Cooler Fan</strong></p><p>Fall billion city share.</p>,Bray LLC,Smartphones,,844,XS,XS,267078141619,529
portable-camera-plus-air-ultra,Portable Camera Plus Air Ultra,<p><strong>Portable Camera Plus Air Ultra</strong></p><p>Reality hair explain up bad.</p>,Wang-Valenzuela,Women's Clothing,,163,L,L,963840013930,197
wireless-powerbank-360-advanced-ultra,Wireless Powerbank 360 Advanced Ultra,<p><strong>Wireless Powerbank 360 Advanced Ultra</strong></p><p>Deal head decade age outside military culture.</p>,Carney Ltd,Bedding & Bath,,418,M,M,3918763032312,677
rechargeable-lamp-speakerphone-headphones,Rechargeable Lamp Speakerphone Headphones,<p><strong>Rechargeable Lamp Speakerphone Headphones</strong></p><p>Effort own safe main walk quickly.</p>,"Gallegos, Osborne and Carpenter",Skincare,,577,L,L,1824359393441,664
mini-scooter-microphone,Mini Scooter Microphone,<p><strong>Mini Scooter Microphone</strong></p><p>Maybe around expect own whether pay.</p>,"Douglas, Thornton and Soto",Grooming Tools,,510,L,L,9839666739792,784
rechargeable-webcam-stove-grill,Rechargeable Webcam Stove Grill,<p><strong>Rechargeable Webcam Stove Grill</strong></p><p>Movement you Mr decide history effect.</p>,Horn-Pope,Health & Wellness,,623,5x7 in,5x7 in,6501687247749,900
mini-iron-drone-wireless-pro,Mini Iron Drone Wireless Pro,<p><strong>Mini Iron Drone Wireless Pro</strong></p><p>From Congress low.</p>,Khan-Parrish,Cycling,,797,XXL,XXL,9496081864722,909
portable-freezer-phone-automatic-smart,Portable Freezer Phone Automatic Smart,<p><strong>Portable Freezer Phone Automatic Smart</strong></p><p>Live fish audience piece his ago true.</p>,Burton PLC,Automotive,,756,XL,XL,3486711401836,350
wireless-webcam-stove-grill,Wireless Webcam Stove Grill,<p><strong>Wireless Webcam Stove Grill</strong></p><p>Pull at improve health also animal forward person.</p>,Henry Group,Clothing & Apparel,,912,50x70 cm,50x70 cm,7097613907430,858
clock-brush,Clock Brush,<p><strong>Clock Brush</strong></p><p>Other another must explain send somebody consider.</p>,Larson-Spence,Furniture,,180,Extra Large,Extra Large,8301096575048,985
keyboard-toaster-monitor,Keyboard Toaster Monitor,<p><strong>Keyboard Toaster Monitor</strong></p><p>My head prove exist change.</p>,Bonilla-Spears,Kids' Clothing,,988,L,L,6639325474032,576
silent-printer-fan-shaver,Silent Printer Fan Shaver,<p><strong>Silent Printer Fan Shaver</strong></p><p>Region week yet weight.</p>,Love LLC,Sports & Outdoors,,669,L,L,5564792899662,102
wireless-scooter-clean-mini,Wireless Scooter Clean Mini,<p><strong>Wireless Scooter Clean Mini</strong></p><p>Green main imagine way suffer wall.</p>,Terry-Oliver,Fragrances,,343,S,S,9921752342730,283
advanced-microphone-cooler-eco,Advanced Microphone Cooler Eco,<p><strong>Advanced Microphone Cooler Eco</strong></p><p>Most other newspaper beyond real.</p>,"Morales, Weaver and Fernandez",Smartphones,,532,Extra Large,Extra Large,7107438924403,904
automatic-brush-fast-eco,Automatic Brush Fast Eco,<p><strong>Automatic Brush Fast Eco</strong></p><p>Record response relationship.</p>,Newman Ltd,Kids' Clothing,,285,8x10 in,8x10 in,2327483415120,407
premium-bicycle-microphone,Premium Bicycle Microphone,<p><strong>Premium Bicycle Microphone</strong></p><p>Congress how list third rise.</p>,"Novak, Archer and Walton",Shoes & Footwear,,364,Extra Large,Extra Large,6209821998907,480
smart-phone-scooter-clean,Smart Phone Scooter Clean,<p><strong>Smart Phone Scooter Clean</strong></p><p>Reality kid create thought window.</p>,Marshall-Dougherty,Women's Clothing,,727,10x10 cm,10x10 cm,7883295446066,635
bicycle,Bicycle,<p><strong>Bicycle</strong></p><p>Garden mother before ten different increase.</p>,Hays-Cunningham,Smartphones,,394,10x10 cm,10x10 cm,7670612815694,234
ultra-dock-trimmer-automatic-edge,Ultra Dock Trimmer Automatic Edge,<p><strong>Ultra Dock Trimmer Automatic Edge</strong></p><p>Do customer stage act send.</p>,Barnes-Glass,Kids' Clothing,,780,5x7 in,5x7 in,2837107354495,640
wireless-tablet-router-printer-wireless-premium-air,Wireless Tablet Router Printer Wireless Premium Air,<p><strong>Wireless Tablet Router Printer Wireless Premium Air</strong></p><p>North meeting short summer situation positive candidate.</p>,Meyers-Hess,Sports & Outdoors,,947,XL,XL,8247903213713,781
clean-printer-advanced-premium-sense,Clean Printer Advanced Premium Sense,<p><strong>Clean Printer Advanced Premium Sense</strong></p><p>Bag away always often join seat direction.</p>,Williamson PLC,Haircare,,820,Small,Small,5234087663802,913
silent-dock-fast,Silent Dock Fast,<p><strong>Silent Dock Fast</strong></p><p>Speak not hospital bit part.</p>,"May, Hendrix and Robbins",Fishing & Hunting,,802,M,M,938364240247,100
ultra-speakerphone-oven-go-smart-x,Ultra Speakerphone Oven Go Smart X,<p><strong>Ultra Speakerphone Oven Go Smart X</strong></p><p>Value bill yeah tell phone.</p>,"Zimmerman, Barr and Davis",Office Supplies,,853,12x18 in,12x18 in,450118214736,999
rechargeable-projector-pro,Rechargeable Projector Pro,<p><strong>Rechargeable Projector Pro</strong></p><p>Bank everything ago girl.</p>,"Levine, Martin and Mccann",Home Decor,,55,XL,XL,655296358115,935
eco-vacuum,Eco Vacuum,<p><strong>Eco Vacuum</strong></p><p>Bit name seat sea.</p>,Werner PLC,Health & Wellness,,668,5x7 in,5x7 in,8611986118980,259
smart-grill-tablet-fridge-go-smart-smart,Smart Grill Tablet Fridge Go Smart Smart,<p><strong>Smart Grill Tablet Fridge Go Smart Smart</strong></p><p>By result ago born become.</p>,"Huff, Cameron and Stephenson",Fitness Equipment,,966,10x10 cm,10x10 cm,9005775281402,488
digital-stove-silent-pro,Digital Stove Silent Pro,<p><strong>Digital Stove Silent Pro</strong></p><p>Suffer range between step mention peace prepare.</p>,"Suarez, Riddle and Sanders",Health & Wellness,,349,Extra Large,Extra Large,5367012957872,161
portable-powerbank-x-air,Portable Powerbank X Air,<p><strong>Portable Powerbank X Air</strong></p><p>Present court note medical bed red movie.</p>,Hanson-Schultz,Camping & Hiking,,263,Large,Large,6854117854742,599
clock,Clock,<p><strong>Clock</strong></p><p>Onto story what job require.</p>,"Malone, Jacobson and Hudson",Team Sports,,664,S,S,1382809012286,731
radio-treadmill,Radio Treadmill,<p><strong>Radio Treadmill</strong></p><p>Through choose record prove happen.</p>,Barron-Little,Office Supplies,,395,XL,XL,5461960384619,511
ultra-cooler-treadmill-touch-pro-ultra,Ultra Cooler Treadmill Touch Pro Ultra,<p><strong>Ultra Cooler Treadmill Touch Pro Ultra</strong></p><p>Certainly simple light safe child PM candidate.</p>,Bonilla-Oconnell,Fragrances,,574,XXL,XXL,3625664059934,214
mini-fridge-camera,Mini Fridge Camera,<p><strong>Mini Fridge Camera</strong></p><p>Little determine at huge month.</p>,Decker and Sons,Fitness Equipment,,832,Extra Large,Extra Large,4894233116968,777
rechargeable-tablet-plus-portable-mini,Rechargeable Tablet Plus Portable Mini,<p><strong>Rechargeable Tablet Plus Portable Mini</strong></p><p>Expect questions about how the sound works.</p>,Mooney-Gonzales,Fragrances,,535,100x200 mm,100x200 mm,8183922928019,820
tablet,Tablet,<p><strong>Tablet</strong></p><p>Many deal community public beyond safe anyone.</p>,"Blake, Weiss and Montgomery",Beauty & Personal Care,,922,Medium,Medium,8183313115592,408
wireless-light-toaster-lite-touch-eco,Wireless Light Toaster Lite Touch Eco,<p><strong>Wireless Light Toaster Lite Touch Eco</strong></p><p>Oil guy table industry hand which.</p>,Singleton PLC,Bedding & Bath,,827,50x70 cm,50x70 cm,3057639268476,791
scooter,Scooter,<p><strong>Scooter</strong></p><p>Small approach possible choose according.</p>,Rivas Group,Cameras & Accessories,,601,L,L,1974896712011,370
advanced-camera-heater-webcam-x-ultra-prime,Advanced Camera Heater Webcam X Ultra Prime,<p><strong>Advanced Camera Heater Webcam X Ultra Prime</strong></p><p>Audience bit past central film each.</p>,Cervantes Ltd,Office Supplies,,372,50x70 cm,50x70 cm,983367163970,224
ultra-keyboard-compact-eco,Ultra Keyboard Compact Eco,<p><strong>Ultra Keyboard Compact Eco</strong></p><p>Bit responsibility cover him mean call civil.</p>,Pace-Hodges,Books & Stationery,,491,8x10 in,8x10 in,8481605893389,514
portable-scale-speaker-powerbank-clean,Portable Scale Speaker Powerbank Clean,<p><strong>Portable Scale Speaker Powerbank Clean</strong></p><p>Throughout special new you view season within.</p>,Morris LLC,Women's Clothing,,332,Small,Small,5175038823985,689
oven-speaker-fan,Oven Speaker Fan,<p><strong>Oven Speaker Fan</strong></p><p>Hot behavior traditional.</p>,Schwartz Ltd,Men's Clothing,,423,Small,Small,2567562782853,489
automatic-speaker-router-lamp-prime,Automatic Speaker Router Lamp Prime,<p><strong>Automatic Speaker Router Lamp Prime</strong></p><p>Word score education thousand high treatment.</p>,"Sexton, Dickerson and Blair",Grooming Tools,,667,5x7 in,5x7 in,6744198567221,621
smart-webcam-projector-lock,Smart Webcam Projector Lock,<p><strong>Smart Webcam Projector Lock</strong></p><p>Subject agree you off.</p>,Stokes Inc,Men's Clothing,,973,Medium,Medium,4811928042234,440
fast-fan,Fast Fan,<p><strong>Fast Fan</strong></p><p>Avoid very final food scene possible.</p>,Ali-Oliver,Cleaning Supplies,,804,100x200 mm,100x200 mm,3388615003133,982
automatic-cooler-edge,Automatic Cooler Edge,<p><strong>Automatic Cooler Edge</strong></p><p>Career for much exist.</p>,"Odonnell, Boyle and Oconnor",Beauty & Personal Care,,513,50x70 cm,50x70 cm,6261793125392,124
advanced-freezer-advanced-advanced,Advanced Freezer Advanced Advanced,<p><strong>Advanced Freezer Advanced Advanced</strong></p><p>Chance material himself soldier.</p>,Gill LLC,Office Supplies,,561,S,S,6474143371206,489
silent-trimmer-shaver-fast,Silent Trimmer Shaver Fast,<p><strong>Silent Trimmer Shaver Fast</strong></p><p>Task point seat better.</p>,Munoz Group,Smartphones,,876,5x7 in,5x7 in,4089415274929,130
treadmill,Treadmill,<p><strong>Treadmill</strong></p><p>Vote only run modern.</p>,"Frost, Christensen and Burnett",Women's Clothing,,744,5x7 in,5x7 in,4598541150958,731
mini-charger-lock-oven-sense-sense,Mini Charger Lock Oven Sense Sense,<p><strong>Mini Charger Lock Oven Sense Sense</strong></p><p>Major tell him share allow.</p>,"Burton, Gross and Giles",Haircare,,623,12x18 in,12x18 in,9282813513019,750
thermostat-trimmer,Thermostat Trimmer,<p><strong>Thermostat Trimmer</strong></p><p>Drug interview hotel decide pattern.</p>,"Hester, Love and Lynch","Accessories (Bags, Hats, Belts)",,677,8x10 in,8x10 in,8282848236311,206
clean-iron-premium-air-wireless,Clean Iron Premium Air Wireless,<p><strong>Clean Iron Premium Air Wireless</strong></p><p>Around tough popular present sign herself pattern.</p>,"Shepherd, Greene and House",Beauty & Personal Care,,700,XXL,XXL,7935749142557,293
compact-mouse-mouse-router-mini,Compact Mouse Mouse Router Mini,<p><strong>Compact Mouse Mouse Router Mini</strong></p><p>Occur miss son Democrat happy.</p>,Barry PLC,Smartwatches,,247,10x10 cm,10x10 cm,252926529077,5
premium-lock-mini-advanced,Premium Lock Mini Advanced,<p><strong>Premium Lock Mini Advanced</strong></p><p>Three character traditional maybe.</p>,"Elliott, Mcfarland and Duran",Automotive,,439,XS,XS,3997003361528,12
silent-webcam-webcam-treadmill-sense-portable-advanced,Silent Webcam Webcam Treadmill Sense Portable Advanced,<p><strong>Silent Webcam Webcam Treadmill Sense Portable Advanced</strong></p><p>Leg my mother father.</p>,George-Day,Makeup,,650,M,M,6908065460286,148
compact-thermostat-oven,Compact Thermostat Oven,<p><strong>Compact Thermostat Oven</strong></p><p>Focus that consumer amount half.</p>,Hull Inc,Home & Kitchen,,747,30x40 cm,30x40 cm,7695934105636,685
wireless-watch-tablet-printer-automatic-eco-sense,Wireless Watch Tablet Printer Automatic Eco Sense,<p><strong>Wireless Watch Tablet Printer Automatic Eco Sense</strong></p><p>Might poor animal must protect blue forward.</p>,Fleming Inc,Smartwatches,,169,Large,Large,1089969929675,59
automatic-blender,Automatic Blender,<p><strong>Automatic Blender</strong></p><p>Smile human machine section bank.</p>,Mahoney-Bryan,Home Decor,,438,8x10 in,8x10 in,310774792552,630
rechargeable-webcam-dock-heater,Rechargeable Webcam Dock Heater,<p><strong>Rechargeable Webcam Dock Heater</strong></p><p>Organization address section collection church gun consumer do.</p>,Kennedy-Gordon,Cycling,,151,XXL,XXL,1340784358003,800
clean-toaster-oven-air-touch,Clean Toaster Oven Air Touch,<p><strong>Clean Toaster Oven Air Touch</strong></p><p>Heavy threat beautiful material assume piece.</p>,Olsen-Sawyer,Kids' Clothing,,71,Medium,Medium,7806787405877,365
brush,Brush,<p><strong>Brush</strong></p><p>Control daughter effect investment piece training nation.</p>,"Lowe, Mosley and Rivera",Bedding & Bath,,623,S,S,168419438521,273
portable-kettle,Portable Kettle,<p><strong>Portable Kettle</strong></p><p>Apply out industry must tell.</p>,Sampson-Leon,Home & Kitchen,,413,L,L,445370808496,50
rechargeable-brush-compact,Rechargeable Brush Compact,<p><strong>Rechargeable Brush Compact</strong></p><p>Early century every amount than past.</p>,Castro-Mccarty,Automotive,,326,S,S,6855062072649,748
fast-heater-cooker-compact-silent,Fast Heater Cooker Compact Silent,<p><strong>Fast Heater Cooker Compact Silent</strong></p><p>Strategy fund mind rather change.</p>,"Decker, Montes and Logan",Makeup,,19,8x10 in,8x10 in,3868467036959,367
mini-drone-x-portable,Mini Drone X Portable,<p><strong>Mini Drone X Portable</strong></p><p>Shoulder cost especially.</p>,Whitney Group,Books & Stationery,,123,Medium,Medium,9437200314292,352
heater-keyboard,Heater Keyboard,<p><strong>Heater Keyboard</strong></p><p>Remember here kind enjoy source room reflect be.</p>,Brooks and Sons,Office Supplies,,208,Extra Large,Extra Large,5328785590239,103
wireless-fan-thermostat-max-automatic-max,Wireless Fan Thermostat Max Automatic Max,<p><strong>Wireless Fan Thermostat Max Automatic Max</strong></p><p>Design price for especially section college over green.</p>,Kaiser-Banks,Books & Stationery,,759,5x7 in,5x7 in,1396411470228,423
fast-keyboard,Fast Keyboard,<p><strong>Fast Keyboard</strong></p><p>Success other institution fear.</p>,Lewis Ltd,Camping & Hiking,,10,50x70 cm,50x70 cm,3163238295239,998
ultra-mixer-toaster-toaster-smart,Ultra Mixer Toaster Toaster Smart,<p><strong>Ultra Mixer Toaster Toaster Smart</strong></p><p>Much guess have pattern southern true hair miss.</p>,Galloway and Sons,Women's Clothing,,221,S,S,4862330962177,342
silent-speakerphone-scanner-monitor,Silent Speakerphone Scanner Monitor,<p><strong>Silent Speakerphone Scanner Monitor</strong></p><p>Quality yet significant lawyer face field yet realize.</p>,Cowan Inc,Fragrances,,580,XXL,XXL,1710131812265,593
silent-scanner-monitor-treadmill,Silent Scanner Monitor Treadmill,<p><strong>Silent Scanner Monitor Treadmill</strong></p><p>Do interesting suggest agreement range admit rule.</p>,"Nichols, Howe and Miller",Health & Wellness,,728,10x10 cm,10x10 cm,1287056757693,30
fast-vacuum-cooler,Fast Vacuum Cooler,<p><strong>Fast Vacuum Cooler</strong></p><p>Explain six firm recent rock skin.</p><ul><li>Feature 1: Description</li><li>Feature 2: Description</li><li>Feature 3: Description</li><li>Feature 4: Description</li><li>Feature 5: Description</li><li>Feature 6: Description</li></ul>,Blair-Russell,Sports & Outdoors,,320,L,L,4874329354658,307
digital-trimmer,Digital Trimmer,<p><strong>Digital Trimmer</strong></p><p>Ago floor nice member wait.</p>,Christian-Tanner,Laptops & Computers,,488,M,M,4147810179628,541
automatic-trimmer-sense,Automatic Trimmer Sense,<p><strong>Automatic Trimmer Sense</strong></p><p>Much table ground information news senior.</p>,Harrington-Valentine,Kitchen Appliances,,950,8x10 in,8x10 in,524638185,405
portable-scooter-wireless-digital,Portable Scooter Wireless Digital,<p><strong>Portable Scooter Wireless Digital</strong></p><p>Thousand various evidence.</p>,Bauer Inc,Cameras & Accessories,,495,Large,Large,4564280934296,519
fridge-cooker,Fridge Cooker,<p><strong>Fridge Cooker</strong></p><p>Try better loss pretty special.</p>,Jackson Group,Furniture,,499,Small,Small,1861389468671,393
scanner,Scanner,<p><strong>Scanner</strong></p><p>Draw material quickly most.</p>,"Wang, Ayala and Bowen",Cleaning Supplies,,63,12x18 in,12x18 in,7794860625802,472
ultra-radio-radio,Ultra Radio Radio,<p><strong>Ultra Radio Radio</strong></p><p>Shoulder red boy away if.</p>,Maldonado-Ritter,Haircare,,639,12x18 in,12x18 in,3611080124547,382
router,Router,<p><strong>Router</strong></p><p>Investment everything story buy.</p>,Atkinson Inc,Laptops & Computers,,703,8x10 in,8x10 in,3330396409604,375
fast-thermostat-microphone-scooter,Fast Thermostat Microphone Scooter,<p><strong>Fast Thermostat Microphone Scooter</strong></p><p>Nature notice themselves news.</p>,Shea Ltd,Beauty & Personal Care,,727,Extra Large,Extra Large,9265397743935,289
eco-heater-toaster-stove-silent-sense,Eco Heater Toaster Stove Silent Sense,<p><strong>Eco Heater Toaster Stove Silent Sense</strong></p><p>Understand still or summer rule.</p>,West Ltd,Cleaning Supplies,,998,Small,Small,5505866454530,232
clean-blender-scale-lite,Clean Blender Scale Lite,<p><strong>Clean Blender Scale Lite</strong></p><p>Final art some push.</p>,"Bell, Gamble and Barrett",Camping & Hiking,,391,5x7 in,5x7 in,3893594435450,241
smart-lamp,Smart Lamp,<p><strong>Smart Lamp</strong></p><p>However public major baby.</p>,"Hebert, Hughes and Trujillo",Bedding & Bath,,518,Medium,Medium,8264263605712,71
